{"$schema":"sourcegraph-adoption-audit-compiled.schema.json","audit_version":1,"by_stratum":[{"evidence_channel":"recognized_agent_identity_commits","exact_agreement_count":1,"exact_agreement_rate":1.0,"language":"Rust","primary_decision":"reject","sample_count":1,"stratum_id":"01e6452d2354dfb28500359d8e6f3cd58f716df7313ec7ccc343b42c078e3442","unresolved_count":0,"unresolved_rate":0.0},{"evidence_channel":"agent_trailer_commits","exact_agreement_count":1,"exact_agreement_rate":1.0,"language":"TOML","primary_decision":"accept_confirmed","sample_count":1,"stratum_id":"079346b84f5d3e8538e0f22f240ad89f5edcf0e3116452b85bfd4e43107c16ae","unresolved_count":0,"unresolved_rate":0.0},{"evidence_channel":"agent_trailer_commits","exact_agreement_count":2,"exact_agreement_rate":1.0,"language":"Go","primary_decision":"accept_confirmed","sample_count":2,"stratum_id":"0b70310de909facffb7542a6ccad5f59c1008def3a88c92243efc2530c7e0651","unresolved_count":0,"unresolved_rate":0.0},{"evidence_channel":"agent_trailer_commits+recognized_agent_identity_commits","exact_agreement_count":1,"exact_agreement_rate":1.0,"language":"JavaScript","primary_decision":"accept_confirmed","sample_count":1,"stratum_id":"0d71194ef909659fb3173d6ead8675df30d9a7c5b6e9a35c84604fe727759f33","unresolved_count":0,"unresolved_rate":0.0},{"evidence_channel":"recognized_agent_identity_commits","exact_agreement_count":1,"exact_agreement_rate":1.0,"language":"Markdown","primary_decision":"reject","sample_count":1,"stratum_id":"0e0fb3e84df16d3db5b873d04d53a0602fd01b34ac32a64045491bdce99c213b","unresolved_count":0,"unresolved_rate":0.0},{"evidence_channel":"recognized_agent_identity_commits","exact_agreement_count":1,"exact_agreement_rate":1.0,"language":"Python","primary_decision":"reject","sample_count":1,"stratum_id":"11ab65717129943a2e741231425ce71e6cc5b4266a38969662b27c36419509e5","unresolved_count":0,"unresolved_rate":0.0},{"evidence_channel":"adoption_announcement_files","exact_agreement_count":3,"exact_agreement_rate":1.0,"language":"JSON","primary_decision":"reject","sample_count":3,"stratum_id":"12bfc91f67af1da138823f06db3bbc946e9347b99eb1d85e3eaa32553a007034","unresolved_count":0,"unresolved_rate":0.0},{"evidence_channel":"agent_trailer_commits","exact_agreement_count":2,"exact_agreement_rate":1.0,"language":"TypeScript","primary_decision":"accept_confirmed","sample_count":2,"stratum_id":"14c0632772f07a5e3fa180c5707a99655a275e672bd3c998a10890a85c31e140","unresolved_count":0,"unresolved_rate":0.0},{"evidence_channel":"adoption_announcement_files","exact_agreement_count":1,"exact_agreement_rate":1.0,"language":"Markdown","primary_decision":"insufficient","sample_count":1,"stratum_id":"16d6122bbab7b4f7cd1a919e6ba29d7d8e60a373e11e17c2a768e715c3d290d3","unresolved_count":0,"unresolved_rate":0.0},{"evidence_channel":"adoption_announcement_files","exact_agreement_count":2,"exact_agreement_rate":1.0,"language":"Shell","primary_decision":"reject","sample_count":2,"stratum_id":"1f1f503f339f2b5255986e55541ba8da584e2c2946c3868bfe84eaad201ac279","unresolved_count":0,"unresolved_rate":0.0},{"evidence_channel":"agent_trailer_commits","exact_agreement_count":1,"exact_agreement_rate":1.0,"language":"SVG","primary_decision":"accept_confirmed","sample_count":1,"stratum_id":"207db7a6a5e6aecf6e3f0009e0b1f75c4947c20ee9c906858414fa166d7c629d","unresolved_count":0,"unresolved_rate":0.0},{"evidence_channel":"generated_code_disclosure_diffs","exact_agreement_count":1,"exact_agreement_rate":1.0,"language":"Java","primary_decision":"reject","sample_count":1,"stratum_id":"20c0380b38d7b628af549ca4093a3b7111862f4fdcabe82cb3661c9a8012ce50","unresolved_count":0,"unresolved_rate":0.0},{"evidence_channel":"adoption_announcement_files","exact_agreement_count":3,"exact_agreement_rate":1.0,"language":"Rust","primary_decision":"reject","sample_count":3,"stratum_id":"221db38ed5f75736991b8a515a7d376cd0e705e3e8fe9fb6cf935295b31dfab6","unresolved_count":0,"unresolved_rate":0.0},{"evidence_channel":"adoption_announcement_files+recognized_agent_identity_commits","exact_agreement_count":1,"exact_agreement_rate":1.0,"language":"Shell","primary_decision":"accept_confirmed","sample_count":1,"stratum_id":"24e6854ec76131042f1f5e288131a77438b8beac038334dde1da5229a79395b9","unresolved_count":0,"unresolved_rate":0.0},{"evidence_channel":"adoption_announcement_files","exact_agreement_count":1,"exact_agreement_rate":1.0,"language":"MDX","primary_decision":"reject","sample_count":1,"stratum_id":"253a8252275fa9dbe49fe01e97dc823811842b7604eea299b525d6d1fd3a433d","unresolved_count":0,"unresolved_rate":0.0},{"evidence_channel":"recognized_agent_identity_commits","exact_agreement_count":0,"exact_agreement_rate":0.0,"language":"C","primary_decision":"insufficient","sample_count":1,"stratum_id":"25c0c8d265e25200ed551aeb1d34ccb55ec18cf5233afde4bcf58961832361b4","unresolved_count":0,"unresolved_rate":0.0},{"evidence_channel":"agent_trailer_commits","exact_agreement_count":1,"exact_agreement_rate":1.0,"language":"Go","primary_decision":"reject","sample_count":1,"stratum_id":"26c0a9f0969e562e8ed05477303359edde9507502f706f3db718e7625b687b52","unresolved_count":0,"unresolved_rate":0.0},{"evidence_channel":"generated_code_disclosure_diffs","exact_agreement_count":1,"exact_agreement_rate":1.0,"language":"TypeScript","primary_decision":"accept_observed","sample_count":1,"stratum_id":"2fddb659865c49be64cb7e158e04b5d347dc6f883cb1bd667b84a27299a67b5f","unresolved_count":0,"unresolved_rate":0.0},{"evidence_channel":"agent_trailer_commits","exact_agreement_count":1,"exact_agreement_rate":1.0,"language":"C","primary_decision":"accept_confirmed","sample_count":1,"stratum_id":"3009ffd8397fe541fc36b8c77f08be447c857c0ea153e1cc5cdbe4398ab28697","unresolved_count":0,"unresolved_rate":0.0},{"evidence_channel":"agent_trailer_commits","exact_agreement_count":1,"exact_agreement_rate":1.0,"language":"Dart","primary_decision":"accept_confirmed","sample_count":1,"stratum_id":"312d59b73703cccec023674a9d2d279596ad044c2467131a604531993757d56d","unresolved_count":0,"unresolved_rate":0.0},{"evidence_channel":"adoption_announcement_files+agent_trailer_commits+recognized_agent_identity_commits","exact_agreement_count":1,"exact_agreement_rate":1.0,"language":"Python","primary_decision":"accept_confirmed","sample_count":1,"stratum_id":"3466f2746a2a8fb3c3395d60d87a0d257c5136b30983aac03895fd5b60653af7","unresolved_count":0,"unresolved_rate":0.0},{"evidence_channel":"generated_code_disclosure_diffs","exact_agreement_count":1,"exact_agreement_rate":1.0,"language":"Bru","primary_decision":"accept_confirmed","sample_count":1,"stratum_id":"3a09dea73086619f80c0ce14c869647868f8ad0b0eeff38cf05f68a2f6a502fb","unresolved_count":0,"unresolved_rate":0.0},{"evidence_channel":"generated_code_disclosure_diffs","exact_agreement_count":1,"exact_agreement_rate":1.0,"language":"CSV","primary_decision":"reject","sample_count":1,"stratum_id":"3b1a58ed23e00bf1eb2893ac408f4adf645f2160dcdc91e1f2accd8b16805cbd","unresolved_count":0,"unresolved_rate":0.0},{"evidence_channel":"agent_trailer_commits","exact_agreement_count":1,"exact_agreement_rate":1.0,"language":"C++","primary_decision":"reject","sample_count":1,"stratum_id":"3c1f87d5bcb3f126b30fe382e2f739ca4a9042e2a989fd74cdf703471c719829","unresolved_count":0,"unresolved_rate":0.0},{"evidence_channel":"generated_code_disclosure_diffs","exact_agreement_count":1,"exact_agreement_rate":1.0,"language":"MDX","primary_decision":"reject","sample_count":1,"stratum_id":"3c3b20f3e89d883fb1afc7087fd267eb597b028ea5046593c28adbb96c8826c6","unresolved_count":0,"unresolved_rate":0.0},{"evidence_channel":"agent_trailer_commits","exact_agreement_count":1,"exact_agreement_rate":1.0,"language":"Text","primary_decision":"accept_confirmed","sample_count":1,"stratum_id":"3cde2b08cdf11c38c35fad9cf1265c3a9a7d0acbad34cc6782d1ca01ba75a787","unresolved_count":0,"unresolved_rate":0.0},{"evidence_channel":"adoption_announcement_files","exact_agreement_count":1,"exact_agreement_rate":1.0,"language":"Go","primary_decision":"accept_observed","sample_count":1,"stratum_id":"3eba1549e252a85b7d723d593b296b63aca60471965b5cf7aab7135b89a72d41","unresolved_count":0,"unresolved_rate":0.0},{"evidence_channel":"agent_trailer_commits","exact_agreement_count":1,"exact_agreement_rate":1.0,"language":"Rust","primary_decision":"accept_confirmed","sample_count":1,"stratum_id":"4001b5095a117627f98de723b8346d488e2ed437250e4f49dcfbc78c2807ec5e","unresolved_count":0,"unresolved_rate":0.0},{"evidence_channel":"generated_code_disclosure_diffs","exact_agreement_count":1,"exact_agreement_rate":1.0,"language":"SQL","primary_decision":"reject","sample_count":1,"stratum_id":"404c0e2aed9e104c9913f3d771f424cbbcd0188e1615315adfabafd60844fef8","unresolved_count":0,"unresolved_rate":0.0},{"evidence_channel":"agent_trailer_commits+generated_code_disclosure_diffs","exact_agreement_count":1,"exact_agreement_rate":1.0,"language":"TypeScript","primary_decision":"insufficient","sample_count":1,"stratum_id":"48f33a3f59eb515bd4141e1a55d1118caa8c97ef9eb9ba8d9c706253a53b2ee0","unresolved_count":0,"unresolved_rate":0.0},{"evidence_channel":"agent_trailer_commits","exact_agreement_count":1,"exact_agreement_rate":1.0,"language":"C","primary_decision":"reject","sample_count":1,"stratum_id":"49d3e295ea8d97558bfe6b85384516ab6616fcf9a9b7e09b828a66eaf6fd96b4","unresolved_count":0,"unresolved_rate":0.0},{"evidence_channel":"generated_code_disclosure_diffs","exact_agreement_count":1,"exact_agreement_rate":1.0,"language":"Rust","primary_decision":"reject","sample_count":1,"stratum_id":"4b9f4f4c0656fc5db9621b6f5f712c5774f5db452816ef812a42e42e7746062e","unresolved_count":0,"unresolved_rate":0.0},{"evidence_channel":"adoption_announcement_files","exact_agreement_count":1,"exact_agreement_rate":1.0,"language":"Markdown","primary_decision":"accept_observed","sample_count":1,"stratum_id":"4c47b42a65c37cdd41ee908278a24c710c6d6b81c009bed890ebd00c2cf1d88f","unresolved_count":0,"unresolved_rate":0.0},{"evidence_channel":"a